{
	"$schema": "exo03_schema.json",
	"sentences": [
		"bonjour Mike"
	],
	"notes": [
		1,
		2,
		3,
		4,
		5
	],
	"mots": [
		"Bonjour",
		"Bonsoir",
		"Carina",
		"Clovis",
		"Ericou"
	],
	"nombres": [
		1,
		-3.7,
		-7
	],
	"person": [
		1,
		"John Doe",
		"john@doe.fr",
		"1991-12-07",
		true
	]
}
